{
  "type": "spirit_spell",
  "id": "spell.word.flattery",
  "name": "Flattery",
  "element": "shame",
  "light_vector": [
    {
      "aspect": "aspect.resonance",
      "delta": 1
    },
    {
      "aspect": "aspect.awareness",
      "delta": -1
    }
  ],
  "cost": 1,
  "kind": "mixed",
  "starter": false,
  "lines": {
    "default": [
      "A man as wise as you surely sees it my way.",
      "Everyone knows you are the cleverest on this street."
    ],
    "weak": [
      "You deserve so much more than they give you. Don't think about it, just take it."
    ]
  }
}
